{
  "sourceQualityMappingConfidenceId": "sourcequalitymappingconfidence-001",
  "generatedAt": "2026-06-10T08:35:00Z",
  "domain": "weather-logistics",
  "qualityMode": "checked_source_quality_mapping_confidence",
  "surfaceBindings": [
    {
      "surface": "source_builder",
      "command": "python3 scripts/ope.py source-builder --case local_draft",
      "recordId": "sourcemanifestbuild-001",
      "status": "draft_ready",
      "artifactPath": "spec/fixtures/generated/source-builder/weather-logistics-local-draft-source-manifest-build.generated.json"
    },
    {
      "surface": "source_adapter_intake",
      "command": "python3 scripts/ope.py source-adapter-intake",
      "recordId": "sourceadapterintake-1301",
      "status": "checked_adapter_intake_matrix",
      "artifactPath": "spec/fixtures/generated/source-adapter-intake/weather-logistics-source-adapter-intake.generated.json"
    },
    {
      "surface": "source_intake_report",
      "command": "python3 scripts/ope.py source-intake",
      "recordId": "sourceintakereport-001",
      "status": "four_checked_source_intake_reports",
      "artifactPath": "spec/fixtures/generated/source-intake/"
    },
    {
      "surface": "setup_method_decision",
      "command": "python3 scripts/ope.py setup-method",
      "recordId": "setupmethoddecision-001",
      "status": "four_checked_setup_method_decisions",
      "artifactPath": "spec/fixtures/generated/setup-method-decision/"
    }
  ],
  "caseRows": [
    {
      "caseId": "sourcequalitycase-001",
      "case": "builder_local_draft",
      "inputSurface": "source_builder",
      "boundRecordIds": {
        "sourceManifestBuildId": "sourcemanifestbuild-001",
        "sourceAdapterOutputId": null,
        "sourceAdapterIntakeCaseId": null,
        "sourceIntakeReportId": null,
        "setupMethodDecisionId": null,
        "sourceManifestId": "sourcemanifestdraft-001",
        "fieldMappingId": "fieldmappingdraft-001"
      },
      "qualityStatus": "needs_mapping_confirmation",
      "recommendedNextAction": "confirm_mappings",
      "dimensions": {
        "freshness": {
          "status": "passed",
          "reasonCodes": [
            "builder_inputs_available_before_close"
          ],
          "summary": "Local builder inspected caller-approved files with forecast-time availability metadata."
        },
        "coverage": {
          "status": "passed",
          "reasonCodes": [
            "builder_draft_sources_inspected"
          ],
          "summary": "Draft sources have enough inspected metadata for source intake."
        },
        "roleFit": {
          "status": "passed",
          "reasonCodes": [
            "builder_source_roles_declared"
          ],
          "summary": "Draft source roles are declared before source intake."
        },
        "entityScope": {
          "status": "needs_confirmation",
          "reasonCodes": [
            "entity_alias_requires_confirmation"
          ],
          "summary": "Entity aliases require caller confirmation."
        },
        "leakageRisk": {
          "status": "passed",
          "reasonCodes": [
            "no_post_outcome_leakage_indicator"
          ],
          "summary": "Builder inputs did not show post-outcome leakage indicators."
        },
        "missingness": {
          "status": "needs_confirmation",
          "reasonCodes": [
            "draft_mapping_requires_confirmation"
          ],
          "summary": "Field completeness is draft-only until mappings are confirmed."
        },
        "outcomeAvailability": {
          "status": "needs_confirmation",
          "reasonCodes": [
            "outcome_role_draft_present"
          ],
          "summary": "A draft outcome role is present but cannot be treated as confirmed until intake."
        },
        "mappingConfidence": {
          "status": "needs_confirmation",
          "reasonCodes": [
            "mapping_requires_confirmation"
          ],
          "summary": "Agent-inferred or draft mappings must be confirmed before method gates."
        }
      },
      "roleSummary": {
        "presentRoles": [
          "declared_operations_outcome",
          "historical_baseline",
          "weather_forecast"
        ],
        "partialRoles": [],
        "missingRequiredRoles": [],
        "rejectedRoles": []
      },
      "mappingSummary": {
        "acceptedMappings": 3,
        "proposedMappings": 10,
        "rejectedMappings": 0,
        "averageConfidence": 0.78
      },
      "forecastImpact": {
        "canEnterSourceIntake": true,
        "canProceedToMethodGate": false,
        "canProduceForecast": false,
        "selectedMethodClass": null,
        "forecastArtifactsCreated": false,
        "qualityClaimAllowed": false,
        "productionReadinessClaimAllowed": false
      },
      "agentSummary": "Local builder drafts can enter source intake only after caller confirmation of proposed mappings."
    },
    {
      "caseId": "sourcequalitycase-002",
      "case": "source_intake_accepted",
      "inputSurface": "source_intake",
      "boundRecordIds": {
        "sourceManifestBuildId": null,
        "sourceAdapterOutputId": null,
        "sourceAdapterIntakeCaseId": null,
        "sourceIntakeReportId": "sourceintakereport-001",
        "setupMethodDecisionId": "setupmethoddecision-001",
        "sourceManifestId": "sourcemanifest-001",
        "fieldMappingId": "fieldmapping-001"
      },
      "qualityStatus": "forecast_usable",
      "recommendedNextAction": "proceed_to_method_gate",
      "dimensions": {
        "freshness": {
          "status": "passed",
          "reasonCodes": [
            "resolution_role_not_forecast_time",
            "source_fresh_enough"
          ],
          "summary": "Forecast-time sources are fresh enough for the declared close time."
        },
        "coverage": {
          "status": "passed",
          "reasonCodes": [
            "baseline_sample_sufficient",
            "not_baseline_source"
          ],
          "summary": "Comparable historical coverage is sufficient for checked setup decisions."
        },
        "roleFit": {
          "status": "passed",
          "reasonCodes": [
            "source_roles_present"
          ],
          "summary": "Source roles fit the declared domain setup."
        },
        "entityScope": {
          "status": "passed",
          "reasonCodes": [
            "entity_scope_matches"
          ],
          "summary": "Source entity scope matches the requested setup."
        },
        "leakageRisk": {
          "status": "passed",
          "reasonCodes": [
            "no_post_outcome_evidence_detected",
            "source_role_resolution_only"
          ],
          "summary": "No post-outcome or post-close evidence is present in forecast-time sources."
        },
        "missingness": {
          "status": "passed",
          "reasonCodes": [
            "all_required_fields_mapped",
            "baseline_sample_sufficient",
            "not_baseline_source"
          ],
          "summary": "Required fields and comparable samples are sufficient for the allowed setup path."
        },
        "outcomeAvailability": {
          "status": "passed",
          "reasonCodes": [
            "outcome_source_declared"
          ],
          "summary": "A declared resolution/outcome source is present for later scoring."
        },
        "mappingConfidence": {
          "status": "passed",
          "reasonCodes": [
            "mappings_confirmed"
          ],
          "summary": "Mappings are confirmed enough for the checked intake or method-decision surface."
        }
      },
      "roleSummary": {
        "presentRoles": [
          "declared_operations_outcome",
          "historical_baseline",
          "weather_forecast"
        ],
        "partialRoles": [],
        "missingRequiredRoles": [],
        "rejectedRoles": []
      },
      "mappingSummary": {
        "acceptedMappings": 10,
        "proposedMappings": 0,
        "rejectedMappings": 0,
        "averageConfidence": 1.0
      },
      "forecastImpact": {
        "canEnterSourceIntake": true,
        "canProceedToMethodGate": true,
        "canProduceForecast": true,
        "selectedMethodClass": "deterministic_statistical",
        "forecastArtifactsCreated": false,
        "qualityClaimAllowed": false,
        "productionReadinessClaimAllowed": false
      },
      "agentSummary": "Confirmed source roles and mappings can proceed to setup method gates."
    },
    {
      "caseId": "sourcequalitycase-003",
      "case": "source_intake_partial",
      "inputSurface": "source_intake",
      "boundRecordIds": {
        "sourceManifestBuildId": null,
        "sourceAdapterOutputId": null,
        "sourceAdapterIntakeCaseId": null,
        "sourceIntakeReportId": "sourceintakereport-002",
        "setupMethodDecisionId": "setupmethoddecision-002",
        "sourceManifestId": "sourcemanifest-002",
        "fieldMappingId": "fieldmapping-002"
      },
      "qualityStatus": "baseline_only_usable",
      "recommendedNextAction": "proceed_to_method_gate",
      "dimensions": {
        "freshness": {
          "status": "passed",
          "reasonCodes": [
            "resolution_role_not_forecast_time",
            "source_fresh_enough"
          ],
          "summary": "Forecast-time sources are fresh enough for the declared close time."
        },
        "coverage": {
          "status": "partial",
          "reasonCodes": [
            "missing_required_source_role"
          ],
          "summary": "Coverage is enough for baseline-only use but not for all configured methods."
        },
        "roleFit": {
          "status": "partial",
          "reasonCodes": [
            "missing_required_source_role"
          ],
          "summary": "A required role is missing; only methods whose role needs are still met can proceed."
        },
        "entityScope": {
          "status": "passed",